<?xml version="1.0" encoding="UTF-8"?>
<!-- Taldeen XML fitxategiaren egitura balioztatzeko XSD-a -->
<xs:schema xmlns:xs="http://www.w3.org/2001/XMLSchema">
  <xs:element name="taldeak">
    <xs:complexType>
      <xs:sequence>
        <xs:element name="taldea" maxOccurs="unbounded">
          <xs:complexType>
            <xs:sequence>
              <xs:element name="id" type="xs:integer"/>
              <xs:element name="izena" type="xs:string"/>
              <xs:element name="irudia" type="xs:string"/>
              <xs:element name="deskribapena" type="xs:string"/>
              <xs:element name="info_url" type="xs:anyURI"/>
            </xs:sequence>
          </xs:complexType>
        </xs:element>
      </xs:sequence>
    </xs:complexType>
  </xs:element>
</xs:schema>
